name,city,county,county_median_price,severity_index,beds,operator_name
Elisabeth Care Home,Pleasant Hill,Contra Costa,6800,23.833333333333332,6,Samuel D'autruche Inc.
"Above & Beyond Rcfe, Inc.",Hayward,Contra Costa,6800,18.333333333333332,6,"Above & Beyond Rcfe, Inc."
Bluegarden Care,San Ramon,Contra Costa,6800,16.666666666666668,6,Bluegarden Care Llc
Bluemeadow Care,San Ramon,Contra Costa,6800,16.166666666666668,6,"Bluemeadow Care, Llc"
La Concepcion Residential Care Home,Fremont,Contra Costa,6800,16.0,6,"Concepcion, Cristina"
George Anne Home,San Mateo,San Mateo,7800,15.833333333333334,6,"Gong, Peter"
Villa Board and Care Home,Rodeo,Contra Costa,6800,15.333333333333334,6,"Villa, Daniel D."
Graces Home,Anaheim,Riverside,5200,15.0,6,Ngoc Mai
"Roundhill Care Homes, Inc.",Alamo,Contra Costa,6800,15.0,6,"Roundhill Care Homes, Inc."
Opal Care Llc,Oakland,Alameda,7200,13.6,15,Opal Care Llc
St Joseph Senior Care,Newark,Contra Costa,6800,12.333333333333334,6,Zenaida C Bautista
Mary's Manor,Fremont,Contra Costa,6800,11.833333333333334,6,"Sunderraj, Mary"
California Mentor-marineview Home,San Leandro,Contra Costa,6800,11.75,4,"National Mentor Healthcare, Llc"
Heart and Soul Communities Ii,San Leandro,Contra Costa,6800,11.333333333333334,6,Ericka Tillis
Vanessa Care Home Ii,San Mateo,San Mateo,7800,11.166666666666666,6,Rosita Nicolas and Ida Galati
A & P Care Home for Seniors,Fremont,Contra Costa,6800,10.666666666666666,6,"A & P Joint Ventures, Inc."
Merisol Care,Fremont,Contra Costa,6800,10.5,6,"Mari, Antonia"
St. Lourdes Home,Hayward,Contra Costa,6800,10.5,6,"Balintona, Justino G."
Good Shepherd of Danville,Danville,Contra Costa,6800,9.833333333333334,6,"Senior Legacy Health Care Services, Inc"
Montgomery Springs Manor,Hayward,Contra Costa,6800,9.733333333333333,15,"Ltp Horizons, Llc"
Hartnell Home Care,Union City,Contra Costa,6800,9.666666666666666,6,"Sandajan, Maria Luz L."
Araville Residential Care Home Ii,San Bruno,San Francisco,8200,9.666666666666666,6,"Paniza, Dorie & Lamberto"
Elle's Home,Hayward,Contra Costa,6800,9.333333333333334,6,Elle's Home Llc
St. Therese Care Home Ii,Union City,Contra Costa,6800,9.166666666666666,6,St. Therese Hope Corp Dba St. Therese Care Home Ii
Ahau Boarding Care Home,San Bruno,San Francisco,8200,9.0,5,"Latu, Temaleti T."
Sandhill Assisted Living Llc,Menlo Park,San Francisco,8200,9.0,6,Sandhill Assisted Living Llc
Mori Manor,San Leandro,Contra Costa,6800,8.857142857142858,14,"Mori Manor, Llc"
K & J Residential Care Home,Fremont,Contra Costa,6800,8.666666666666666,6,"Liang, Ksai"
Charitys Residence,Oakland,Alameda,7200,8.666666666666666,6,Caridad O. Aquino
Always Tlc,Foster City,San Mateo,7800,8.333333333333334,6,Tomas L. Consunji & Christine L. Consunji
Grace Home Care - Lloyd,Livermore,Contra Costa,6800,8.166666666666666,6,Del Rosario-fajardo Corporation
Reliez Valley Care Home,Martinez,Contra Costa,6800,8.166666666666666,6,Jmel Corporation Dba Reliez Valley Care Home
Tri City Care Home,Union City,Contra Costa,6800,8.166666666666666,6,"Bvr, Inc."
New Rivershore Care Home,Bay Point,Contra Costa,6800,8.166666666666666,6,"Balancio, Aurora"
C & L Home for the Elderly,Union City,Contra Costa,6800,7.833333333333333,6,Mimj Corporation
Alamo Care Home,Alamo,Contra Costa,6800,7.666666666666667,6,Alamo Care Home Llc
Sunshine Care Home Facility Llc,San Bruno,San Francisco,8200,7.666666666666667,6,Sunshine Care Home Facility Llc
Carewell Manor,Anaheim,Riverside,5200,7.5,6,"Wilson, Carol R."
C & R Home for the Elderly,Union City,Contra Costa,6800,7.333333333333333,6,"San Miguel, Precilla & Romeo"
West Valley Care Home,Campbell,Santa Clara,7500,7.166666666666667,6,"Zhang, Biao"
Colonial Acres Residential Care Home,Hayward,Contra Costa,6800,7.15,20,"Olivarez, John Ronald"
California Sunshine Rcfe,Clayton,Contra Costa,6800,7.0,6,"Sylvia Usa, Llc"
Loving Hands Care Home Llc,Rodeo,Contra Costa,6800,6.833333333333333,6,Loving Hands Care Home Llc
Merisol Care Home,Union City,Contra Costa,6800,6.666666666666667,6,"Mari, Antonia B & Bacani, Soledad F"
Hrs Care Home,Livermore,Contra Costa,6800,6.666666666666667,6,"De Luna, Diosdado"
Harmony Homes Llc,Union City,Contra Costa,6800,6.666666666666667,6,Harmony Homes Llc
Carnelian Villas,Anaheim,Riverside,5200,6.666666666666667,6,Carnelian Villas Llc
Galicia's Tulip Care Home #2,Hayward,Contra Costa,6800,6.5,6,"Galicia, Rolando & Consuelo"
Tri City Care Home Ii,Fremont,Contra Costa,6800,6.333333333333333,6,"Bvr, Inc."
Shannen Guest Home,Livermore,Contra Costa,6800,6.333333333333333,6,"De Luna, Diosdado"
Ageway Boarding Care #3,Union City,Contra Costa,6800,6.333333333333333,6,Ageway Senior Care
Cordial Care Home,Pleasant Hill,Contra Costa,6800,5.833333333333333,6,Cordial Care Home Inc
Begonia Residential Care Home,Union City,Contra Costa,6800,5.833333333333333,6,"Bolloso, Jovita"
Acacia Guest Home-anaheim,Anaheim,Riverside,5200,5.666666666666667,6,Acacia Guest Home Llc
"Old Oak Golden Villa, Llc",Livermore,Contra Costa,6800,5.666666666666667,6,"Old Oak Golden Villa, Llc"
Boyd Senior Care Home,Pleasant Hill,Contra Costa,6800,5.666666666666667,6,"Perdiguerra, Lilia"
Common Destiny,Fremont,Contra Costa,6800,5.5,6,"Common Destiny, Llc"
Maureen House,Pleasant Hill,Contra Costa,6800,5.5,6,Our Families for Senior Inc.
Sunrise Private Care,Livermore,Contra Costa,6800,5.5,6,"Nagy, Levente"
Britta Care,Anaheim,Riverside,5200,5.333333333333333,6,Advanced Care Llc
Merisol Care Home,Union City,Contra Costa,6800,5.333333333333333,6,"Mari, Antonia B & Bacani, Soledad F"
Muriel's Residential Facility,Fremont,Contra Costa,6800,5.166666666666667,6,"Jenkins, Irene Muriel & Arthur Russell"
A Gabriela's Villa-livermore,Livermore,Contra Costa,6800,5.166666666666667,6,"C.j.l. Joint Ventures, Inc."
Pleasant Hill Villa Home Care,Pleasant Hill,Contra Costa,6800,5.0,6,Pleasant Hill Villa Home Care
Abigail's Guest Home,Pleasanton,Contra Costa,6800,5.0,6,"Jaakk, Inc."
Sunvalley Residential Care Home,Pleasant Hill,Contra Costa,6800,5.0,6,"Sunvalley Residential Care Home, Inc."
Valle Verde Care Home Iii,Pleasanton,Contra Costa,6800,4.666666666666667,6,Jgv Group. Inc.
Ava Bella Care Home,Union City,Contra Costa,6800,4.5,6,Avabella Care Home Llc
Angel Comfort Care 2,Anaheim,Riverside,5200,4.333333333333333,6,Angel Comfort Care Inc
Royal Colony View Place,Hayward,Contra Costa,6800,4.25,8,"Royal Colony View Place, Llc"
Care Celine,Anaheim,Riverside,5200,4.166666666666667,6,Celaron Manors Llc
Abigail's Guest Home,San Ramon,Contra Costa,6800,4.0,6,"Jaakk, Inc."
Amistad Assisted Living and Memory Care Home,Corona,Riverside,5200,4.0,6,Perpetual Inspirations
Olympic Residential Care Home,Martinez,Contra Costa,6800,4.0,6,"Gozun, Conchita Q."
Gonzales Home,San Francisco,San Francisco,8200,4.0,6,"Gonzales, Rogelio & Prosperidad"
Casa Pastel Care Home,Mountain View,San Francisco,8200,4.0,6,"Zhao, Ping Jing"
Hidden Lane Villa,Los Altos,San Francisco,8200,4.0,6,"Carr, Theresa"
Heavenly Care Home,Newark,Contra Costa,6800,3.6666666666666665,6,Heavenly Care Home Llc
Sandhill Assisted Living Llc,Menlo Park,San Francisco,8200,3.6666666666666665,6,Sandhill Assisted Living Llc
Sweet Care Home in Gilroy,Gilroy,Santa Clara,7500,3.5,6,Sweet Care Llc
Portola Place,San Mateo,San Mateo,7800,3.5,6,"Atienza, Armand"
Pacaldo Llc,San Bruno,San Francisco,8200,3.5,6,Pacaldo Llc
Peninsula Village,San Mateo,San Mateo,7800,3.3333333333333335,6,"S.f. Sun Care Group, Llc"
"Oakley Assisted Living Ii , Llc",Oakley,Contra Costa,6800,3.1666666666666665,6,Oakley Assisted Living Ii Llc
Victoria Hills Assisted Living and Memory Care,Riverside,Orange,6000,3.0,6,Alara Health Services Inc.
Lafayette Gardens,Lafayette,Contra Costa,6800,3.0,6,Saxena Family Llc
Kennedy Guest Home,Livermore,Contra Costa,6800,3.0,6,"Kennedy Guest Home, Llc"
Continuance Care Home Llc,Hayward,Contra Costa,6800,3.0,16,Continuance Care Home Llc
Muriel's Residential Facility Ii,Fremont,Contra Costa,6800,2.8333333333333335,6,Irene & Arthur Jenkins
Emerald Home Care,Dublin,Contra Costa,6800,2.8333333333333335,6,Emerald Home Care
Stonehedge Guest Home,Pleasant Hill,Contra Costa,6800,2.8333333333333335,6,Stonehedge Llc
B. Ruiz Carehome 2,Oakley,Contra Costa,6800,2.8333333333333335,6,B Ruiz Care Home Inc
Olivia's Care Home Ii,San Mateo,San Mateo,7800,2.8333333333333335,6,Primecare Llc
"Dysico Care Home, Rcfe",Pleasant Hill,Contra Costa,6800,2.5,6,"Dysico Care Home, Inc"
Granny's Loving Angels Llc,Danville,Contra Costa,6800,2.5,6,Granny's Loving Angels Llc
Hearts at Millwood Assisted Living,Millbrae,San Francisco,8200,2.5,6,Hearts at Millwood Rcfe Inc
Assisted Living and Memory Care by Inspirations,Corona,Riverside,5200,2.3333333333333335,6,Our Holy Mother Assisted Living Community Inc
Ramona Care Home,Pleasant Hill,Contra Costa,6800,2.3333333333333335,6,"Lingbanan, Victoria M."
Safe Haven Oakley Llc,Oakley,Contra Costa,6800,2.3333333333333335,6,Safe Haven Oakley Llc
Pleasant Hill Manor,Hayward,Contra Costa,6800,2.1666666666666665,6,Richard W. Gindlesberger
Millbrae Family Care Home,Millbrae,San Francisco,8200,2.1666666666666665,6,Josver Residential Care
"Khivi Care, Llc",Livermore,Contra Costa,6800,2.1666666666666665,6,"Khivi Care, Llc"
Ageway Boarding Care #2,San Mateo,San Mateo,7800,2.1666666666666665,6,Ageway Senior Care
Enchanted Garden for Seniors,San Mateo,San Mateo,7800,2.1666666666666665,6,"Giusto Jr., Jack & Giusto, Ferlene"
Blossom Garden Senior Home,Hayward,Contra Costa,6800,2.111111111111111,9,"Blossom Garden Senior Home, Llc"
Aegis Residential Living,Mission Viejo,Orange,6000,2.0,6,Salvador Diaz Jr
Paradise Care Home,Mountain View,San Francisco,8200,2.0,6,"Zhao, Ping Jing"
Santa Barbara Memory Care,Santa Barbara,Santa Barbara,6300,1.9722222222222223,36,"Pac Coast Inc,gp of Pac Coast Lp;santa Barbara Mgr"
Milan Villa Senior Living,Livermore,Contra Costa,6800,1.875,24,"La Jolla Cove Holdings, Llc"
Hennelly House,San Mateo,San Mateo,7800,1.6666666666666667,6,"Stefanac, Suzi"
Chateau Sabelle,San Mateo,San Mateo,7800,1.6666666666666667,6,"Castle, Nancy"
Divine Grace Villa,Anaheim,Riverside,5200,1.6666666666666667,6,"Divine Grace Villa, Inc."
Caringbridge Inc.,Anaheim,Riverside,5200,1.6666666666666667,6,Caringbridge Inc.
April Garden Villa of Saratoga,Saratoga,Santa Clara,7500,1.6,5,"De la Fuente, Valentin"
Navajo Care Home,Alamo,Contra Costa,6800,1.5,6,Bethel Care Inc
A New Haven Care Home - Hampton,Livermore,Contra Costa,6800,1.5,6,"Soleta Holdings, Inc."
Janet's Residential Facility for the Elderly,San Francisco,San Francisco,8200,1.5,8,"Spires, Janet"
Unity Memory Home Care,Antelope,Sacramento,5400,1.5,6,Unity Memory Care Inc
"Ark, the",Redwood City,San Francisco,8200,1.5,6,Caring Hearts Senior Living Llc
Rosegate,San Leandro,Contra Costa,6800,1.475,40,"Kati Knox & Associates, Inc.;rosemont Gardens,inc."
Better Living Care Home,Pleasant Hill,Contra Costa,6800,1.375,8,"Bl Homes, Inc."
Francel Guest Home Ii,Anaheim,Riverside,5200,1.3571428571428572,14,"Francel Guest Home, Inc."
Family Connect Memory Care Inc,Torrance,Los Angeles,5800,1.3333333333333333,6,Family Connect Memory Care Inc
Villa Vittoria,Martinez,Contra Costa,6800,1.3333333333333333,6,"Baiocchi, Vickie"
Cayco's Care Home,San Francisco,San Francisco,8200,1.3333333333333333,6,Maribel G Cayco
Eden Assisted Living,Castro Valley,Contra Costa,6800,1.3333333333333333,6,Special Request Llc
Citrus Gardens,Hemet,Orange,6000,1.2363636363636363,55,Citrus Gardens Leasing Llc
"D'nalor Care Homes, Llc",Oakland,Alameda,7200,1.1666666666666667,6,"D'nalor Care Homes, Llc"
San Mateo Villa,San Mateo,San Mateo,7800,1.1666666666666667,6,"Viducich, Elizabeth & Loncar, Violet"
Heritage Place,San Mateo,San Mateo,7800,1.1666666666666667,12,"Heritage Residential Care, Inc.; Almacare Inc"
La Posada,Whittier,Los Angeles,5800,1.0789473684210527,114,Posada Sl Llc
Scott Villa,Hayward,Contra Costa,6800,1.0571428571428572,35,Scott Villas Corporation
Burlingame Senior Living,Burlingame,San Francisco,8200,1.0222222222222221,90,Pacifica Burlingame Lp;burlingame Mgr Llc
Pleasant Hill Oasis,Pleasant Hill,Contra Costa,6800,1.0204081632653061,49,Ph Senior Care Llc; Northstar Senior Living Inc
Seabright Assisted Living and Memory Care,Solana Beach,San Diego,6200,1.0,6,Alara Health Services Inc
Lily & Rose Senior Living Inc,Altadena,Los Angeles,5800,1.0,6,Lily & Rose Senior Living Inc
Britannia Place,Redwood City,San Francisco,8200,1.0,6,"Williams, Delphine Ellen"
Arlington Heights Assisted Living and Memory Care,Riverside,Orange,6000,1.0,6,Alara Health Services Inc
Penny's Guest Home,San Ramon,Contra Costa,6800,1.0,6,"Penny's Guest Home, Llc"
"Golden Hill Homes, Inc.",San Ramon,Contra Costa,6800,1.0,6,"Golden Hill Homes, Inc."
Regency Palms Long Beach,Long Beach,Los Angeles,5800,1.0,91,"Global Regency Snr Care Svcs,llc"
Bentley Suites,Santa Monica,Los Angeles,5800,0.9545454545454546,44,Specialized Community Healthcare Company
Bella Vista,Hayward,Contra Costa,6800,0.9523809523809523,42,"Ark Angel Ii, Llc"
"Cottages at Artesia Anaheim, the",Anaheim,Riverside,5200,0.868421052631579,38,"Cottages at Artesia Llc, the"
Eaton Place,Alamo,Contra Costa,6800,0.8333333333333334,6,"Bl Homes, Inc."
Damenik's Home,San Francisco,San Francisco,8200,0.8333333333333334,12,"Damenik's Home, Inc. Dba Damenik's Home"
South Bay Memory Care,Torrance,Los Angeles,5800,0.8333333333333334,6,South Bay Memory Care Inc
Lincoln Villa,Fremont,Contra Costa,6800,0.8157894736842105,76,"Lincoln Retirement Villa, Llc"
Avenir Memory Care Westside,Los Angeles,Los Angeles,5800,0.8068181818181818,88,"Amcla Gp Inc. ; Avenir Senior Living, Llc"
Princess Lodge,Campbell,Santa Clara,7500,0.8,30,"Morales,james & Judith"
Tuscany Villa Senior Living,Livermore,Contra Costa,6800,0.7419354838709677,31,"Kenai River Holdings, Llc"
Oak Cottage of Santa Barbara Memory Care,Santa Barbara,Santa Barbara,6300,0.72,50,Oak Cottage Operator Nt Hci Llc; Integral Sl Mgmt
Brittany House,Long Beach,Los Angeles,5800,0.711764705882353,170,Brittany Healthcare Llc
Lafayette Heights Res. Care,Lafayette,Contra Costa,6800,0.6666666666666666,6,"Mogadam, Joanne A."
Bed of Roses Residential Care Home,Campbell,Santa Clara,7500,0.6666666666666666,6,"Williams, Maria Christina"
Elegance Berkeley,Berkeley,Alameda,7200,0.65,120,"Berkely Ca Operator, Llc;elegance Living,llc"
Newport Beach Memory Care,Newport Beach,Orange,6000,0.6428571428571429,42,"Corktree Holdings, Llc"
Brookdale Danville,Danville,Contra Costa,6800,0.6428571428571429,42,Summerville at Barrington Court; Emeritus Corp
Diana's Care Home,Hayward,Contra Costa,6800,0.6285714285714286,35,Scott Villas Corporation;diana's Care Home
San Leandro Senior Living,San Leandro,Contra Costa,6800,0.6222222222222222,90,P San Leandro Lp; San Leandro Mgr Llc
Pacifica Senior Living Union City,Union City,Contra Costa,6800,0.6181818181818182,110,Pacifica Union City Llc; Union City Mgr Llc
Newport Mesa Senior Living,Costa Mesa,Orange,6000,0.6,40,Pacifica Newport Mesa Llc; Newport Mesa Mgr Llc
"Gardens at Laguna Springs Memory Care, the",Elk Grove,Sacramento,5400,0.6,70,"Elk Grove Memory Care, Llc"
Country Rose Estate Memory Care,San Marcos,San Diego,6200,0.6,15,"Paraiso, Catherine T"
Beach Terrace Assisted Living and Memory Care,Stanton,Los Angeles,5800,0.5833333333333334,120,"Sal Asset Mgmt, Llc; Klmh Enterprises, Llc"
Bonita Villa Senior Living,Chula Vista,San Diego,6200,0.5724137931034483,145,Pacfica Sl Ca Llc;pacifica Bonita Lp; Bonita Mgr
"Bethany Home Senior Living, Llc",Livermore,Contra Costa,6800,0.5689655172413793,58,"Bethany Homes Senior Living, Llc"
Astoria Park Senior Living,Pasadena,Los Angeles,5800,0.5454545454545454,220,Astoria Park Senior Living Llc
Marymount Villa Retirement Center,San Leandro,Contra Costa,6800,0.5454545454545454,99,"Marymount Villa, Llc"
Eskaton Gold River Lodge,Gold River,Sacramento,5400,0.5447761194029851,134,Eskaton
Golden Pond Retirement Community,Sacramento,Sacramento,5400,0.5257142857142857,175,"Walgenbach, Brian & Gill, Doug"
Whitten Heights Assisted Living and Memory Care,La Habra,Los Angeles,5800,0.5255102040816326,196,Whitten Llc
Aegis Living Corte Madera,Corte Madera,Marin,7600,0.5066666666666667,150,Bmsh Ii Corte Madera Ca; Aegis Senior Communities
Dimond Care,Oakland,Alameda,7200,0.5,30,"Dimond Care, Llc"
Sunrise Care Home,San Lorenzo,Contra Costa,6800,0.5,6,"Tayag, Nancy"
Desert Hills Memory Care Center,Hemet,Orange,6000,0.5,58,Cascade Lvg Grp Hemet; Kre Tiger Desert Hills Op
A Silver Amore Senior Home,Eastvale,Riverside,5200,0.5,6,"Blind Moose, Llc"
Valle Verde Care Home Iv,Pleasanton,Contra Costa,6800,0.5,6,"Jgv Group, Inc"
Sakura Gardens at los Angeles,Los Angeles,Los Angeles,5800,0.4972677595628415,183,Pacifica Sl Boyle Llc; Northstar Senior Living Inc
Silverado Senior Living - the Huntington,Alhambra,Los Angeles,5800,0.4838709677419355,62,Subtenant 1118 N Stoneman; Silverado Sr Lvg Mgt
Ivy Park at Hayward,Hayward,Contra Costa,6800,0.4764705882352941,170,Hayward Sr. Hsng. I Opco Llc;oakmont Mgmt Grp Llc
Avantgarde Senior Living of la Jolla,La Jolla,San Diego,6200,0.4666666666666667,45,Avantgarde Senior Living of la Jolla
Pico de Loro,Perris,Orange,6000,0.4444444444444444,45,"Pico de Loro, Inc."
Meadowbrook at Agoura Hills,Agoura Hills,Los Angeles,5800,0.43783783783783786,185,"Arhc Mbaghca01 Trs; Slh Agoura Hills Manager, Llc"
Ivy Park at Laguna Creek,Elk Grove,Sacramento,5400,0.4351851851851852,108,"S-h Opco Laguna Creek, Llc; Oakmont Mgmt. Grp. Llc"
Avantgarde Senior Living of Tarzana,Tarzana,Los Angeles,5800,0.43478260869565216,138,Avantgarde Senior Living
"Terraces at Via Verde-a Memory Care Community, the",San Dimas,Los Angeles,5800,0.43333333333333335,60,"Adp of San Dimas, Llc; Agemark Management Llc"
Hollywood Hills Senior Living,Los Angeles,Los Angeles,5800,0.425,120,Pacifica Hollywood Llc; Hollywood Mgr Llc
"Watermark at San Ramon, the",San Ramon,Contra Costa,6800,0.4105263157894737,95,San Ramon Sr Hsg Llc;integral Sr Living Mgmt Llc
Caleo Bay Alzheimer's Special Care Center,La Quinta,Riverside,5200,0.3939393939393939,66,"Westbrook Mgmt, Llc; Laquinta Investors Lp"
Silverado Senior Living - Calabasas,Calabasas,Los Angeles,5800,0.39090909090909093,110,Subtenant 25100 Calabasas Rd; Silverado Sr Lvg Mgt
Pacifica Senior Living South Coast,Costa Mesa,Orange,6000,0.3877551020408163,98,Pacifica Orange County Llc; Costa Mesa Operations
Aegis Assisted Living of Carmichael,Carmichael,Sacramento,5400,0.37777777777777777,90,Aegis Senior Communities Llc
Fremont Village,Fremont,Contra Costa,6800,0.375,120,Premier Senior Care Group Corporation
"Havens at Antelope Valley Assisted Living, the",Lancaster,Kern,4500,0.34782608695652173,115,Welltower Pegasus Tenant Llc; Psl Associates Llc
Aegis Assisted Living of Napa,Napa,Contra Costa,6800,0.3392857142857143,56,"Aegis Senior Communities, Llc"
Westwind Memory Care,Santa Cruz,Santa Clara,7500,0.3389830508474576,59,Seasons Mgt; Sm Santa Cruz Memory; Amv Capital Grp
"Oaks at Nipomo, the",Nipomo,San Luis Obispo,5900,0.3360655737704918,122,"Nipomo Oaks,gp of Nipomo Oaks Ops Lp;westmont Lvng"
Roias Home for the Elderly,San Mateo,San Mateo,7800,0.3333333333333333,6,"Roias, Michelle"
Memory Care of Contra Costa,Pleasant Hill,Contra Costa,6800,0.3333333333333333,75,"Carlton Senior Living, Llc"
Brookdale Corona,Corona,Riverside,5200,0.3333333333333333,60,Emeritus Corporation
Roseville Senior Living,Roseville,Sacramento,5400,0.3333333333333333,6,"Sungarden Villa, Inc."
Mina's Elderly Carehome 2,Los Gatos,Santa Clara,7500,0.3333333333333333,6,"Mina's Elderly Carehome 3, Llc"
Canyon Crest Assisted Living and Memory Care,Riverside,Orange,6000,0.3333333333333333,6,Alara Health Services Inc
Autumn Glow,San Francisco,San Francisco,8200,0.3333333333333333,15,"Autumn Glow Alzheimer's Home, Inc."
Willow View Gardens Memory Care & Assisted Living,Santa Ana,Orange,6000,0.33076923076923076,130,All Health Holdings Corp
Cottages at Hemet,Hemet,Orange,6000,0.32727272727272727,110,Pacifica Sl Hemet Llc;hemet Mgr Llc
Emerald Valley,Dublin,Contra Costa,6800,0.325,80,"Amador Valley 1, Llc;msl Community Mgmt Llc"
Oakland Heights Senior Living,Oakland,Alameda,7200,0.3248730964467005,197,Pacifica Oakland Llc & Lp; Oakland Mgr Llc
Sun City Gardens,Sun City,Orange,6000,0.3108108108108108,74,Bradley Road Holdings Llc;ca Sr. Lvng. Mgmt. Llc
Carefield Pleasanton,Pleasanton,Contra Costa,6800,0.3048780487804878,82,"Sh 10 Pleasanton Opco, Llc ; Crfld Management, Llc"
Bethany Homes Senior Living Ii,Livermore,Contra Costa,6800,0.3,20,Bethany Home 3234 Llc
Kimochi Home,San Francisco,San Francisco,8200,0.3,20,"Kimochi, Inc."
"Gardens at Park Balboa, the",Van Nuys,Los Angeles,5800,0.3,120,"Park Balboa, Lp, Garrett Loube, Managing Partner"
"Pavilion at el Dorado Hills, the",El Dorado Hills,Sacramento,5400,0.296875,64,El Dorado Hills Memory Care; Mosaic Management Inc
Brookdale Folsom,Folsom,Sacramento,5400,0.2923076923076923,130,Emeritus Corporation
Creston Village Assisted Living and Memory Care,Paso Robles,San Luis Obispo,5900,0.2923076923076923,130,Welltower Pegasus Tenant Llc; Psl Associates Llc
Silverado Senior Living-berkeley,Berkeley,Alameda,7200,0.28888888888888886,90,Silverado Berkeley Llc; Silverado Sr Lvng Mgmt Inc
Bellamar Lancaster,Lancaster,Kern,4500,0.27941176470588236,68,"Lancaster Ventures, Llc; Integral Senior Liv Mgmt"
Cogir of Folsom,Folsom,Sacramento,5400,0.2727272727272727,66,Well Ca Wa Tenant Llc; Cogir Management Usa Inc
Almond Heights,Orangevale,Sacramento,5400,0.2620689655172414,145,Almond Heights Msl Llc;msl Community Mgmt Llc
Sunrise Assisted Living of Carmichael,Carmichael,Sacramento,5400,0.25757575757575757,66,Ms Carmichael Sh Llc; Sunrise Senior Living Mgt
Oakmont of Valencia,Valencia,Los Angeles,5800,0.2569444444444444,144,"Oakmont Sr. Lvng. of Valencia Opco, Llc: Oakmont"
La Marea Senior Living,Carlsbad,San Diego,6200,0.256,125,Carlsbad Operating Llc; Integral Snr Lvg Mgmt Llc
Carlton Plaza of San Leandro,San Leandro,Contra Costa,6800,0.25125628140703515,199,"Carlton Senior Living, Llc"
Ivy Park at San Ramon,San Ramon,Contra Costa,6800,0.24691358024691357,162,Well Ivy 6 Tenant Llc;oakmont Management Group Llc
Vista del Lago Memory Care,Escondido,San Diego,6200,0.23958333333333334,96,"Del Dios Care, Llc;bayshire, Llc"
Sunrise Assisted Living of Danville,Danville,Contra Costa,6800,0.23595505617977527,89,Sunrise West Al Gp & Lp; Sunrise Senior Living Mgt
Cogir of South Bay,Torrance,Los Angeles,5800,0.23529411764705882,34,Torrance Operations Llc; Cadence Sl Torrance Llc
Sagebrook Senior Living at San Francisco,San Francisco,San Francisco,8200,0.23423423423423423,111,Eden Villa Prop Llc;integral Senior Liv Mgmt Llc
Ivy Park at Otay Ranch,Chula Vista,San Diego,6200,0.23357664233576642,137,Otay Tenant Llc and Oakmont Management Group Llc
Aegis Assisted Living of Fremont,Fremont,Contra Costa,6800,0.21818181818181817,110,"Aegis Senior Communities, Llc"
Regency Place,Sacramento,Sacramento,5400,0.21311475409836064,61,"Regency Place Acquisitions Opco, Llc;northstar Sr"
Aegis Assisted Living of Aptos,Aptos,Santa Clara,7500,0.21,100,Heather Terrace Aptos Llc;aegis Sr Communities Llc
"Point at Rockridge, the",Oakland,Alameda,7200,0.20967741935483872,186,Ag-acp Rockridge Trs Llc;integral Snr Lvg Mgmt Llc
Ivy Terrace at Fullerton,Fullerton,Riverside,5200,0.20833333333333334,72,Welltower Tenant Group Llc;oakmont Mgmt Group Llc
Ivy Park at Cathedral Hill,San Francisco,San Francisco,8200,0.20476190476190476,210,Coventry Subtenant Lp;oakmont Management Group Llc
Alta Vista Senior Living,Vista,San Diego,6200,0.20408163265306123,98,Pacifica Regency Palms Llc; Alta Vista Mgr Llc
Merrill Gardens at Gilroy,Gilroy,Santa Clara,7500,0.20093457943925233,214,"Mg at Gilroy, Lp ; Shi-iv Merrill Gp, Llc ; Merril"
Brookdale North Fremont,Fremont,Contra Costa,6800,0.2,40,Summerville at Atherton Court Llc
Aegis Living Pleasant Hill,Pleasant Hill,Contra Costa,6800,0.2,90,Oak Park Blvd Pleasant Hill Llc; Aegis Senior Et a
Brookdale Garden Grove,Garden Grove,Riverside,5200,0.2,140,Summerville at Cobbco Inc; Emeritus Corporation
Summerfield of Encinitas,Encinitas,San Diego,6200,0.19642857142857142,56,"Snh Cal Tenant Llc; Northstar Senior Living, Inc."
Ivy Park at Cerritos,Cerritos,Los Angeles,5800,0.19631901840490798,163,Cerritos Subtenant Lp;oakmont Mgmt. Group Llc
Sunol Creek Memory Care,Pleasanton,Contra Costa,6800,0.1956521739130435,46,Pri Sunol Llc; Agemark Management Llc
"Sea Bluffs, the",Dana Point,Orange,6000,0.19318181818181818,88,Well Oak Tenant Llc;oakmont Management Group Llc
"Watermark at Rosewood Gardens, the",Livermore,Contra Costa,6800,0.19130434782608696,115,"Watermark Livermore Llc; Watermark Rtmt Comm, Llc"
Cottages at Palm Springs,Palm Springs,Riverside,5200,0.18947368421052632,95,Pacifica Sl Palm Springs Llc;palm Springs Mgr Llc
Fremont Hills,Fremont,Contra Costa,6800,0.18571428571428572,140,Fremont Hills Sr Housing; Atsc Ii Llc
Belmont Village Sabre Springs,San Diego,San Diego,6200,0.18478260869565216,184,Belmont Village Sabre Spr Tnnt & Lp; Belmont Three
Silverado Senior Living-sierra Vista,Azusa,Los Angeles,5800,0.1839080459770115,87,Silverado Sierra Vista Llc; Silverado Sr Lvng Mgmt
Loma Clara Senior Living,Morgan Hill,Santa Clara,7500,0.1797752808988764,89,Steadfast Collin Morgan Hill Llc;integral Sr Lg Mg
Vista Cove at Rancho Mirage,Rancho Mirage,Riverside,5200,0.17647058823529413,68,"Vista Cove at Rancho Mirage, Inc."
Sunshine Villa Assisted Living and Memory Care,Santa Cruz,Santa Clara,7500,0.17424242424242425,132,Mg Santa Cruz Subtenant Llc; Merrill Gardens Llc
"Montera, the",La Mesa,San Diego,6200,0.17333333333333334,225,Montera Msl Llc;msl Community Management Llc
"Watermark at Westwood Village, the",Los Angeles,Los Angeles,5800,0.1729957805907173,237,Westwood Sr Hsg Llc; Atsc Ii Llc
Las Villas del Norte,Escondido,San Diego,6200,0.1717171717171717,198,Escondido Sh Llc; Integral Senior Lvg Mgmt Llc
Belmont Village Cardiff,Cardiff by the Sea,San Diego,6200,0.17142857142857143,175,Belmont Village Cardiff Tenant & Lp; Belmont Three
